SQL> select snum from customers where snum=(select c.snum from customers where c.snum=snum and count(snum)>1;
select snum from customers where snum=(select c.snum from customers where c.snum=snum and count(snum)>1
                                       *
ERROR at line 1:
ORA-00921: unexpected end of SQL command 


SQL> select snum from customers c1 where c1.snum=(select c1.snum from customers c2 where c1.snum=c2.snum and count(c2.snum) > 1;
select snum from customers c1 where c1.snum=(select c1.snum from customers c2 where c1.snum=c2.snum and count(c2.snum) > 1
                                             *
ERROR at line 1:
ORA-00921: unexpected end of SQL command 


SQL> select snum from customers c1 where c1.snum=(select c1.snum from customers c2 where c1.snum=c2.snum and count(c2.snum) > 1;clear screen
  2  ;
select snum from customers c1 where c1.snum=(select c1.snum from customers c2 where c1.snum=c2.snum and count(c2.snum) > 1;clear screen
                                                                                                                          *
ERROR at line 1:
ORA-00911: invalid character 


SQL> clear screen

SQL> select count(snum) from salespeople group by snum;

COUNT(SNUM)                                                                     
-----------                                                                     
          1                                                                     
          1                                                                     
          1                                                                     
          1                                                                     
          1                                                                     
          1                                                                     

6 rows selected.

SQL> select count(snum) from customers group by snum;

COUNT(SNUM)                                                                     
-----------                                                                     
          1                                                                     
          2                                                                     
          1                                                                     
          3                                                                     

SQL> select snum,count(snum) from customers group by snum;

      SNUM COUNT(SNUM)                                                          
---------- -----------                                                          
      1003           1                                                          
      1001           2                                                          
      1007           1                                                          
      1004           3                                                          

SQL> select snum from customers group by snum;

      SNUM                                                                      
----------                                                                      
      1003                                                                      
      1001                                                                      
      1007                                                                      
      1004                                                                      

SQL> select snum from customers where count(snum)>1;
select snum from customers where count(snum)>1
                                 *
ERROR at line 1:
ORA-00934: group function is not allowed here 


SQL> select snum from customers group by snum;

      SNUM                                                                      
----------                                                                      
      1003                                                                      
      1001                                                                      
      1007                                                                      
      1004                                                                      

SQL> select * from salespeople where snum = (select snum from customers group by snum where count(snum)>1);
select * from salespeople where snum = (select snum from customers group by snum where count(snum)>1)
                                                                                 *
ERROR at line 1:
ORA-00907: missing right parenthesis 


SQL> select * from salespeople where snum = (select snum from customers group by snum having count(snum)>1);
select * from salespeople where snum = (select snum from customers group by snum having count(snum)>1)
                                        *
ERROR at line 1:
ORA-01427: single-row subquery returns more than one row 


SQL> select * from salespeople where snum in (select snum from customers group by snum having count(snum)>1);

      SNUM SNAME      CITY             COMM                                     
---------- ---------- ---------- ----------                                     
      1001 Peel       London            .12                                     
      1004 Motika     London            .11                                     

SQL> create table multicast
  2  as
  3  select * from salespeople where snum in (select snum from customers group by snum having count(snum)>1);

Table created.

SQL> select * from multicast;

      SNUM SNAME      CITY             COMM                                     
---------- ---------- ---------- ----------                                     
      1004 Motika     London            .11                                     
      1001 Peel       London            .12                                     

SQL> select * from customers;

      CNUM CNAME      CITY           RATING       SNUM                          
---------- ---------- ---------- ---------- ----------                          
      2001 Hoffman    London            100       1001                          
      2002 Giovanni   Rome              300       1003                          
      2003 Liu        San Jose          200       1004                          
      2004 Grass      Berlin            300       1004                          
      2006 Clemens    London            100       1001                          
      2008 Cisneros   San Jose          300       1007                          
      2007 Pereira    Rome              200       1004                          

7 rows selected.

SQL> select * from orders;

      ONUM        AMT ODATE           CNUM       SNUM                           
---------- ---------- --------- ---------- ----------                           
      3001      18.69 03-OCT-90       2008       1007                           
      3003     767.19 03-OCT-90       2001       1001                           
      3002     1900.1 03-OCT-90       2007       1004                           
      3005    5160.45 03-OCT-90       2003       1002                           
      3006    1098.16 03-OCT-90       2008       1007                           
      3009    1713.23 04-OCT-90       2002       1003                           
      3007      75.75 04-OCT-90       2004       1002                           
      3010    1309.95 06-OCT-90       2004       1002                           

8 rows selected.

SQL> select * from orders group by cnum,odate;
select * from orders group by cnum,odate
       *
ERROR at line 1:
ORA-00979: not a GROUP BY expression 


SQL> select * from orders group by cnum;
select * from orders group by cnum
       *
ERROR at line 1:
ORA-00979: not a GROUP BY expression 


SQL> select cnum from orders group by cnum;

      CNUM                                                                      
----------                                                                      
      2001                                                                      
      2007                                                                      
      2003                                                                      
      2004                                                                      
      2008                                                                      
      2002                                                                      

6 rows selected.

SQL> select cnum,odate from orders group by cnum;
select cnum,odate from orders group by cnum
            *
ERROR at line 1:
ORA-00979: not a GROUP BY expression 


SQL> select cnum,odate from orders group by cnum,odate;

      CNUM ODATE                                                                
---------- ---------                                                            
      2001 03-OCT-90                                                            
      2008 03-OCT-90                                                            
      2003 03-OCT-90                                                            
      2004 06-OCT-90                                                            
      2007 03-OCT-90                                                            
      2002 04-OCT-90                                                            
      2004 04-OCT-90                                                            

7 rows selected.

SQL> select cnum,odate from orders group by cnum;
select cnum,odate from orders group by cnum
            *
ERROR at line 1:
ORA-00979: not a GROUP BY expression 


SQL> select cnum from orders group by cnum;

      CNUM                                                                      
----------                                                                      
      2001                                                                      
      2007                                                                      
      2003                                                                      
      2004                                                                      
      2008                                                                      
      2002                                                                      

6 rows selected.

SQL> select cnum from orders group by cnum asc;
select cnum from orders group by cnum asc
                                      *
ERROR at line 1:
ORA-00933: SQL command not properly ended 


SQL> select cnum from orders group by cnum desc;
select cnum from orders group by cnum desc
                                      *
ERROR at line 1:
ORA-00933: SQL command not properly ended 


SQL> select cnum from orders group by cnum;

      CNUM                                                                      
----------                                                                      
      2001                                                                      
      2007                                                                      
      2003                                                                      
      2004                                                                      
      2008                                                                      
      2002                                                                      

6 rows selected.

SQL> select cnum,odate from orders group by cnum,odate;

      CNUM ODATE                                                                
---------- ---------                                                            
      2001 03-OCT-90                                                            
      2008 03-OCT-90                                                            
      2003 03-OCT-90                                                            
      2004 06-OCT-90                                                            
      2007 03-OCT-90                                                            
      2002 04-OCT-90                                                            
      2004 04-OCT-90                                                            

7 rows selected.

SQL> select cnum from orders group by cnum;

      CNUM                                                                      
----------                                                                      
      2001                                                                      
      2007                                                                      
      2003                                                                      
      2004                                                                      
      2008                                                                      
      2002                                                                      

6 rows selected.

SQL> select cnum,count(cnum) from orders group by cnum;

      CNUM COUNT(CNUM)                                                          
---------- -----------                                                          
      2001           1                                                          
      2007           1                                                          
      2003           1                                                          
      2004           2                                                          
      2008           2                                                          
      2002           1                                                          

6 rows selected.

SQL> set autocommit off
SQL> select cnum,count(cnum) from orders group by cnum order by cnum;

      CNUM COUNT(CNUM)                                                          
---------- -----------                                                          
      2001           1                                                          
      2002           1                                                          
      2003           1                                                          
      2004           2                                                          
      2007           1                                                          
      2008           2                                                          

6 rows selected.

SQL> select * from orders;

      ONUM        AMT ODATE           CNUM       SNUM                           
---------- ---------- --------- ---------- ----------                           
      3001      18.69 03-OCT-90       2008       1007                           
      3003     767.19 03-OCT-90       2001       1001                           
      3002     1900.1 03-OCT-90       2007       1004                           
      3005    5160.45 03-OCT-90       2003       1002                           
      3006    1098.16 03-OCT-90       2008       1007                           
      3009    1713.23 04-OCT-90       2002       1003                           
      3007      75.75 04-OCT-90       2004       1002                           
      3010    1309.95 06-OCT-90       2004       1002                           

8 rows selected.

SQL> select onum from orders group by cnum order by cnum;
select onum from orders group by cnum order by cnum
       *
ERROR at line 1:
ORA-00979: not a GROUP BY expression 


SQL> select cnum from orders group by cnum order by cnum;

      CNUM                                                                      
----------                                                                      
      2001                                                                      
      2002                                                                      
      2003                                                                      
      2004                                                                      
      2007                                                                      
      2008                                                                      

6 rows selected.

SQL> select cnum,max(odate) from orders group by cnum order by cnum;

      CNUM MAX(ODATE                                                            
---------- ---------                                                            
      2001 03-OCT-90                                                            
      2002 04-OCT-90                                                            
      2003 03-OCT-90                                                            
      2004 06-OCT-90                                                            
      2007 03-OCT-90                                                            
      2008 03-OCT-90                                                            

6 rows selected.

SQL> select onum,cnum,max(odate) from orders group by cnum order by cnum;
select onum,cnum,max(odate) from orders group by cnum order by cnum
       *
ERROR at line 1:
ORA-00979: not a GROUP BY expression 


SQL> select onum,cnum,max(odate) from orders group by cnum,onum order by cnum;

      ONUM       CNUM MAX(ODATE                                                 
---------- ---------- ---------                                                 
      3003       2001 03-OCT-90                                                 
      3009       2002 04-OCT-90                                                 
      3005       2003 03-OCT-90                                                 
      3007       2004 04-OCT-90                                                 
      3010       2004 06-OCT-90                                                 
      3002       2007 03-OCT-90                                                 
      3001       2008 03-OCT-90                                                 
      3006       2008 03-OCT-90                                                 

8 rows selected.

SQL> select onum from orders where (cnum,maxodate) IN (select cnum,max(odate) from orders group by cnum order by cnum);
select onum from orders where (cnum,maxodate) IN (select cnum,max(odate) from orders group by cnum order by cnum)
                                                                                                   *
ERROR at line 1:
ORA-00920: invalid relational operator 


SQL> select onum from orders where (cnum,maxodate) IN (select cnum,max(odate) from orders);
select onum from orders where (cnum,maxodate) IN (select cnum,max(odate) from orders)
                                    *
ERROR at line 1:
ORA-00904: "MAXODATE": invalid identifier 


SQL> select onum from orders where (cnum,max(odate) IN (select cnum,max(odate) from orders);
select onum from orders where (cnum,max(odate) IN (select cnum,max(odate) from orders)
                                    *
ERROR at line 1:
ORA-00920: invalid relational operator 


SQL> select onum from orders where (cnum,odate) IN (select cnum,max(odate) from orders);
select onum from orders where (cnum,odate) IN (select cnum,max(odate) from orders)
                                                      *
ERROR at line 1:
ORA-00937: not a single-group group function 


SQL> select onum from orders where (cnum,odate) IN (select cnum,max(odate) from orders group by cnum);

      ONUM                                                                      
----------                                                                      
      3003                                                                      
      3002                                                                      
      3005                                                                      
      3010                                                                      
      3006                                                                      
      3001                                                                      
      3009                                                                      

7 rows selected.

SQL> select * from orders;

      ONUM        AMT ODATE           CNUM       SNUM                           
---------- ---------- --------- ---------- ----------                           
      3001      18.69 03-OCT-90       2008       1007                           
      3003     767.19 03-OCT-90       2001       1001                           
      3002     1900.1 03-OCT-90       2007       1004                           
      3005    5160.45 03-OCT-90       2003       1002                           
      3006    1098.16 03-OCT-90       2008       1007                           
      3009    1713.23 04-OCT-90       2002       1003                           
      3007      75.75 04-OCT-90       2004       1002                           
      3010    1309.95 06-OCT-90       2004       1002                           

8 rows selected.

SQL> select onum,odate from orders where (cnum,odate) IN (select cnum,max(odate) from orders group by cnum);

      ONUM ODATE                                                                
---------- ---------                                                            
      3003 03-OCT-90                                                            
      3002 03-OCT-90                                                            
      3005 03-OCT-90                                                            
      3010 06-OCT-90                                                            
      3006 03-OCT-90                                                            
      3001 03-OCT-90                                                            
      3009 04-OCT-90                                                            

7 rows selected.

SQL> delete from orders where (onum,odate) NOT IN (select onum,odate from orders where (cnum,odate) IN (select cnum,max(odate) from orders group by cnum));

1 row deleted.

SQL> select * from orders;

      ONUM        AMT ODATE           CNUM       SNUM                           
---------- ---------- --------- ---------- ----------                           
      3001      18.69 03-OCT-90       2008       1007                           
      3003     767.19 03-OCT-90       2001       1001                           
      3002     1900.1 03-OCT-90       2007       1004                           
      3005    5160.45 03-OCT-90       2003       1002                           
      3006    1098.16 03-OCT-90       2008       1007                           
      3009    1713.23 04-OCT-90       2002       1003                           
      3010    1309.95 06-OCT-90       2004       1002                           

7 rows selected.

SQL> rollback
  2  ;

Rollback complete.

SQL> select * from orders;

      ONUM        AMT ODATE           CNUM       SNUM                           
---------- ---------- --------- ---------- ----------                           
      3001      18.69 03-OCT-90       2008       1007                           
      3003     767.19 03-OCT-90       2001       1001                           
      3002     1900.1 03-OCT-90       2007       1004                           
      3005    5160.45 03-OCT-90       2003       1002                           
      3006    1098.16 03-OCT-90       2008       1007                           
      3009    1713.23 04-OCT-90       2002       1003                           
      3007      75.75 04-OCT-90       2004       1002                           
      3010    1309.95 06-OCT-90       2004       1002                           

8 rows selected.

SQL> delete from orders where odate='03-OCT-90';

5 rows deleted.

SQL> select * from orders;

      ONUM        AMT ODATE           CNUM       SNUM                           
---------- ---------- --------- ---------- ----------                           
      3009    1713.23 04-OCT-90       2002       1003                           
      3007      75.75 04-OCT-90       2004       1002                           
      3010    1309.95 06-OCT-90       2004       1002                           

SQL> rollback;

Rollback complete.

SQL> select * from orders;

      ONUM        AMT ODATE           CNUM       SNUM                           
---------- ---------- --------- ---------- ----------                           
      3001      18.69 03-OCT-90       2008       1007                           
      3003     767.19 03-OCT-90       2001       1001                           
      3002     1900.1 03-OCT-90       2007       1004                           
      3005    5160.45 03-OCT-90       2003       1002                           
      3006    1098.16 03-OCT-90       2008       1007                           
      3009    1713.23 04-OCT-90       2002       1003                           
      3007      75.75 04-OCT-90       2004       1002                           
      3010    1309.95 06-OCT-90       2004       1002                           

8 rows selected.

SQL> delete from orders where odate<max(odate);
delete from orders where odate<max(odate)
                               *
ERROR at line 1:
ORA-00934: group function is not allowed here 


SQL> delete from orders where odate < (select max(odate) from orders);

7 rows deleted.

SQL> select * from orders;

      ONUM        AMT ODATE           CNUM       SNUM                           
---------- ---------- --------- ---------- ----------                           
      3010    1309.95 06-OCT-90       2004       1002                           

SQL> rollback;

Rollback complete.

SQL> select * from orders;

      ONUM        AMT ODATE           CNUM       SNUM                           
---------- ---------- --------- ---------- ----------                           
      3001      18.69 03-OCT-90       2008       1007                           
      3003     767.19 03-OCT-90       2001       1001                           
      3002     1900.1 03-OCT-90       2007       1004                           
      3005    5160.45 03-OCT-90       2003       1002                           
      3006    1098.16 03-OCT-90       2008       1007                           
      3009    1713.23 04-OCT-90       2002       1003                           
      3007      75.75 04-OCT-90       2004       1002                           
      3010    1309.95 06-OCT-90       2004       1002                           

8 rows selected.

SQL> delete from orders
  2  where odate ='03-oct-90';

5 rows deleted.

SQL> select * from orders;

      ONUM        AMT ODATE           CNUM       SNUM                           
---------- ---------- --------- ---------- ----------                           
      3009    1713.23 04-OCT-90       2002       1003                           
      3007      75.75 04-OCT-90       2004       1002                           
      3010    1309.95 06-OCT-90       2004       1002                           

SQL> rollback;

Rollback complete.

SQL> update salespeople
  2  set comm=comm+comm*0.20
  3  where amt > 3000;
where amt > 3000
      *
ERROR at line 3:
ORA-00904: "AMT": invalid identifier 


SQL> select * from orders;

      ONUM        AMT ODATE           CNUM       SNUM                           
---------- ---------- --------- ---------- ----------                           
      3001      18.69 03-OCT-90       2008       1007                           
      3003     767.19 03-OCT-90       2001       1001                           
      3002     1900.1 03-OCT-90       2007       1004                           
      3005    5160.45 03-OCT-90       2003       1002                           
      3006    1098.16 03-OCT-90       2008       1007                           
      3009    1713.23 04-OCT-90       2002       1003                           
      3007      75.75 04-OCT-90       2004       1002                           
      3010    1309.95 06-OCT-90       2004       1002                           

8 rows selected.

SQL> update salespeople
  2  
SQL> 
SQL> select * from salespeople;

      SNUM SNAME      CITY             COMM                                     
---------- ---------- ---------- ----------                                     
      1001 Peel       London            .12                                     
      1002 Serres     San Jose          .13                                     
      1004 Motika     London            .11                                     
      1007 Rifkin     Barcelona         .15                                     
      1003 Axelrod    New York           .1                                     
      1100 Blanco     San Jose                                                  

6 rows selected.

SQL> update salespeople
  2  set comm=comm+comm*0.20
  3  where snum IN (select snum from orders where amt>3000);

1 row updated.

SQL> select * from salespeople;

      SNUM SNAME      CITY             COMM                                     
---------- ---------- ---------- ----------                                     
      1001 Peel       London            .12                                     
      1002 Serres     San Jose          .16                                     
      1004 Motika     London            .11                                     
      1007 Rifkin     Barcelona         .15                                     
      1003 Axelrod    New York           .1                                     
      1100 Blanco     San Jose                                                  

6 rows selected.

SQL> rollback;

Rollback complete.

SQL> select * from salespeople;

      SNUM SNAME      CITY             COMM                                     
---------- ---------- ---------- ----------                                     
      1001 Peel       London            .12                                     
      1002 Serres     San Jose          .13                                     
      1004 Motika     London            .11                                     
      1007 Rifkin     Barcelona         .15                                     
      1003 Axelrod    New York           .1                                     
      1100 Blanco     San Jose                                                  

6 rows selected.

SQL> exit
